Bus Hound 6.01 capture on Windows Vista (x64). Complements of www.perisoft.net

uvcÃ¶¾Ù

  Device - Device ID (followed by the endpoint for USB devices)
            (11) USB Composite Device
            (15) Logitech HD Webcam C270
            (16) HD Webcam C270
            (22) Generic SuperSpeed USB Hub
            (23) Generic USB Hub
            (24) Azure Kinect Depth Camera
            (25) USB Composite Device
            (26) Azure Kinect Microphone Array
            (27) USB Input Device
            (28) HID-compliant device
            (29) USB Composite Device
            (30) Azure Kinect 4K Camera
            (31) Azure Kinect 4K Camera
  Phase  - Phase Type
            CTL   USB control transfer       
            IN    Data in transfer           
            OUT   Data out transfer          
            USTS  USB status                 
  Data   - Hex dump of the data transferred
  Descr  - Description of the phase
  Cmd... - Position in the captured data


Device  Phase  Data                                                                                                    Description                       Cmd.Phase.Ofs(rep)
------  -----  ------------------------------------------------------------------------------------------------------  --------------------------------  ------------------     
  15.0  CTL    80 06 00 01  00 00 12 00                                                                                GET DESCRIPTOR                           5.1.0        
  15.0  IN     12 01 00 02  ef 02 01 40  6d 04 25 08  12 00 00 00  02 01                                               .......@m.%.......                       5.2.0        
  15.0  CTL    80 06 00 02  00 00 09 00                                                                                GET DESCRIPTOR                           6.1.0        
  15.0  IN     09 02 ad 08  02 01 00 80  fa                                                                            .........                                6.2.0        
  15.0  CTL    80 06 00 02  00 00 ad 08                                                                                GET DESCRIPTOR                           7.1.0        
  15.0  IN     09 02 ad 08  02 01 00 80  fa 09 04 00  00 01 0e 01  00 00 0d 24  01 00 01 a0  00 00 6c dc  02 01 01 12  ...................$......l.....         7.2.0        
  15.0  CTL    00 09 01 00  00 00 00 00                                                                                SET CONFIG                               8.1.0        
  15.0  CTL    a1 85 00 01  00 03 02 00                                                                                GET LEN                                  9.1.0        
  15.0  IN     04 00                                                                                                   ..                                       9.2.0        
  15.0  CTL    a1 86 00 01  00 03 01 00                                                                                GET INFO                                10.1.0        
  15.0  IN     01                                                                                                      .                                       10.2.0        
  15.0  CTL    a1 85 00 01  00 03 02 00                                                                                GET LEN                                 11.1.0        
  15.0  IN     04 00                                                                                                   ..                                      11.2.0        
  15.0  CTL    a1 84 00 01  00 03 04 00                                                                                GET RES                                 12.1.0        
  15.0  IN     01 07 f3 03                                                                                             ....                                    12.2.0        
  15.0  CTL    a1 82 00 01  00 03 04 00                                                                                GET MIN                                 13.1.0        
  15.0  IN     01 07 f3 03                                                                                             ....                                    13.2.0        
  15.0  CTL    a1 83 00 01  00 03 04 00                                                                                GET MAX                                 14.1.0        
  15.0  IN     01 07 f3 03                                                                                             ....                                    14.2.0        
  15.0  CTL    a1 87 00 01  00 03 04 00                                                                                GET DEF                                 15.1.0        
  15.0  IN     01 07 f3 03                                                                                             ....                                    15.2.0        
  15.0  CTL    a1 85 00 02  00 03 02 00                                                                                GET LEN                                 16.1.0        
  15.0  IN     02 00                                                                                                   ..                                      16.2.0        
  15.0  CTL    a1 86 00 02  00 03 01 00                                                                                GET INFO                                17.1.0        
  15.0  IN     01                                                                                                      .                                       17.2.0        
  15.0  CTL    a1 85 00 02  00 03 02 00                                                                                GET LEN                                 18.1.0        
  15.0  IN     02 00                                                                                                   ..                                      18.2.0        
  15.0  CTL    a1 84 00 02  00 03 02 00                                                                                GET RES                                 19.1.0        
  15.0  IN     1c de                                                                                                   ..                                      19.2.0        
  15.0  CTL    a1 82 00 02  00 03 02 00                                                                                GET MIN                                 20.1.0        
  15.0  IN     1c de                                                                                                   ..                                      20.2.0        
  15.0  CTL    a1 83 00 02  00 03 02 00                                                                                GET MAX                                 21.1.0        
  15.0  IN     1c de                                                                                                   ..                                      21.2.0        
  15.0  CTL    a1 87 00 02  00 03 02 00                                                                                GET DEF                                 22.1.0        
  15.0  IN     1c de                                                                                                   ..                                      22.2.0        
  15.0  CTL    a1 85 00 03  00 03 02 00                                                                                GET LEN                                 23.1.0        
  15.0  IN     02 00                                                                                                   ..                                      23.2.0        
  15.0  CTL    a1 86 00 03  00 03 01 00                                                                                GET INFO                                24.1.0        
  15.0  IN     01                                                                                                      .                                       24.2.0        
  15.0  CTL    a1 85 00 03  00 03 02 00                                                                                GET LEN                                 25.1.0        
  15.0  IN     02 00                                                                                                   ..                                      25.2.0        
  15.0  CTL    a1 84 00 03  00 03 02 00                                                                                GET RES                                 26.1.0        
  15.0  IN     be ef                                                                                                   ..                                      26.2.0        
  15.0  CTL    a1 82 00 03  00 03 02 00                                                                                GET MIN                                 27.1.0        
  15.0  IN     be ef                                                                                                   ..                                      27.2.0        
  15.0  CTL    a1 83 00 03  00 03 02 00                                                                                GET MAX                                 28.1.0        
  15.0  IN     be ef                                                                                                   ..                                      28.2.0        
  15.0  CTL    a1 87 00 03  00 03 02 00                                                                                GET DEF                                 29.1.0        
  15.0  IN     be ef                                                                                                   ..                                      29.2.0        
  15.0  CTL    a1 85 00 04  00 03 02 00                                                                                GET LEN                                 30.1.0        
  15.0  IN     02 00                                                                                                   ..                                      30.2.0        
  15.0  CTL    a1 86 00 04  00 03 01 00                                                                                GET INFO                                31.1.0        
  15.0  IN     01                                                                                                      .                                       31.2.0        
  15.0  CTL    a1 85 00 04  00 03 02 00                                                                                GET LEN                                 32.1.0        
  15.0  IN     02 00                                                                                                   ..                                      32.2.0        
  15.0  CTL    a1 84 00 04  00 03 02 00                                                                                GET RES                                 33.1.0        
  15.0  IN     02 00                                                                                                   ..                                      33.2.0        
  15.0  CTL    a1 82 00 04  00 03 02 00                                                                                GET MIN                                 34.1.0        
  15.0  IN     02 00                                                                                                   ..                                      34.2.0        
  15.0  CTL    a1 83 00 04  00 03 02 00                                                                                GET MAX                                 35.1.0        
  15.0  IN     02 00                                                                                                   ..                                      35.2.0        
  15.0  CTL    a1 87 00 04  00 03 02 00                                                                                GET DEF                                 36.1.0        
  15.0  IN     02 00                                                                                                   ..                                      36.2.0        
  15.0  CTL    a1 85 00 05  00 03 02 00                                                                                GET LEN                                 37.1.0        
  15.0  IN     02 00                                                                                                   ..                                      37.2.0        
  15.0  CTL    a1 86 00 05  00 03 01 00                                                                                GET INFO                                38.1.0        
  15.0  IN     01                                                                                                      .                                       38.2.0        
  15.0  CTL    a1 85 00 05  00 03 02 00                                                                                GET LEN                                 39.1.0        
  15.0  IN     02 00                                                                                                   ..                                      39.2.0        
  15.0  CTL    a1 84 00 05  00 03 02 00                                                                                GET RES                                 40.1.0        
  15.0  IN     01 72                                                                                                   .r                                      40.2.0        
  15.0  CTL    a1 82 00 05  00 03 02 00                                                                                GET MIN                                 41.1.0        
  15.0  IN     01 72                                                                                                   .r                                      41.2.0        
  15.0  CTL    a1 83 00 05  00 03 02 00                                                                                GET MAX                                 42.1.0        
  15.0  IN     01 72                                                                                                   .r                                      42.2.0        
  15.0  CTL    a1 87 00 05  00 03 02 00                                                                                GET DEF                                 43.1.0        
  15.0  IN     01 72                                                                                                   .r                                      43.2.0        
  15.0  CTL    a1 85 00 06  00 03 02 00                                                                                GET LEN                                 44.1.0        
  15.0  IN     06 00                                                                                                   ..                                      44.2.0        
  15.0  CTL    a1 86 00 06  00 03 01 00                                                                                GET INFO                                45.1.0        
  15.0  IN     01                                                                                                      .                                       45.2.0        
  15.0  CTL    a1 85 00 06  00 03 02 00                                                                                GET LEN                                 46.1.0        
  15.0  IN     06 00                                                                                                   ..                                      46.2.0        
  15.0  CTL    a1 84 00 06  00 03 06 00                                                                                GET RES                                 47.1.0        
  15.0  IN     6d 04 25 08  12 00                                                                                      m.%...                                  47.2.0        
  15.0  CTL    a1 82 00 06  00 03 06 00                                                                                GET MIN                                 48.1.0        
  15.0  IN     6d 04 25 08  12 00                                                                                      m.%...                                  48.2.0        
  15.0  CTL    a1 83 00 06  00 03 06 00                                                                                GET MAX                                 49.1.0        
  15.0  IN     6d 04 25 08  12 00                                                                                      m.%...                                  49.2.0        
  15.0  CTL    a1 87 00 06  00 03 06 00                                                                                GET DEF                                 50.1.0        
  15.0  IN     6d 04 25 08  12 00                                                                                      m.%...                                  50.2.0        
  15.0  CTL    a1 85 00 09  00 03 02 00                                                                                GET LEN                                 51.1.0        
  15.0  IN     02 00                                                                                                   ..                                      51.2.0        
  15.0  CTL    a1 86 00 09  00 03 01 00                                                                                GET INFO                                52.1.0        
  15.0  IN     01                                                                                                      .                                       52.2.0        
  15.0  CTL    a1 85 00 09  00 03 02 00                                                                                GET LEN                                 53.1.0        
  15.0  IN     02 00                                                                                                   ..                                      53.2.0        
  15.0  CTL    a1 84 00 09  00 03 02 00                                                                                GET RES                                 54.1.0        
  15.0  IN     be ef                                                                                                   ..                                      54.2.0        
  15.0  CTL    a1 82 00 09  00 03 02 00                                                                                GET MIN                                 55.1.0        
  15.0  IN     be ef                                                                                                   ..                                      55.2.0        
  15.0  CTL    a1 83 00 09  00 03 02 00                                                                                GET MAX                                 56.1.0        
  15.0  IN     be ef                                                                                                   ..                                      56.2.0        
  15.0  CTL    a1 87 00 09  00 03 02 00                                                                                GET DEF                                 57.1.0        
  15.0  IN     be ef                                                                                                   ..                                      57.2.0        
  15.0  CTL    a1 85 00 0a  00 03 02 00                                                                                GET LEN                                 58.1.0        
  15.0  IN     04 00                                                                                                   ..                                      58.2.0        
  15.0  CTL    a1 86 00 0a  00 03 01 00                                                                                GET INFO                                59.1.0        
  15.0  IN     01                                                                                                      .                                       59.2.0        
  15.0  CTL    a1 85 00 0a  00 03 02 00                                                                                GET LEN                                 60.1.0        
  15.0  IN     04 00                                                                                                   ..                                      60.2.0        
  15.0  CTL    a1 84 00 0a  00 03 04 00                                                                                GET RES                                 61.1.0        
  15.0  IN     00 05 d0 02                                                                                             ....                                    61.2.0        
  15.0  CTL    a1 82 00 0a  00 03 04 00                                                                                GET MIN                                 62.1.0        
  15.0  IN     00 05 d0 02                                                                                             ....                                    62.2.0        
  15.0  CTL    a1 83 00 0a  00 03 04 00                                                                                GET MAX                                 63.1.0        
  15.0  IN     00 05 d0 02                                                                                             ....                                    63.2.0        
  15.0  CTL    a1 87 00 0a  00 03 04 00                                                                                GET DEF                                 64.1.0        
  15.0  IN     00 05 d0 02                                                                                             ....                                    64.2.0        
  15.0  CTL    a1 85 00 01  00 04 02 00                                                                                GET LEN                                 65.1.0        
  15.0  IN     01 00                                                                                                   ..                                      65.2.0        
  15.0  CTL    a1 86 00 01  00 04 01 00                                                                                GET INFO                                66.1.0        
  15.0  IN     03                                                                                                      .                                       66.2.0        
  15.0  CTL    a1 85 00 01  00 04 02 00                                                                                GET LEN                                 67.1.0        
  15.0  IN     01 00                                                                                                   ..                                      67.2.0        
  15.0  CTL    a1 84 00 01  00 04 01 00                                                                                GET RES                                 68.1.0        
  15.0  IN     01                                                                                                      .                                       68.2.0        
  15.0  CTL    a1 82 00 01  00 04 01 00                                                                                GET MIN                                 69.1.0        
  15.0  IN     00                                                                                                      .                                       69.2.0        
  15.0  CTL    a1 83 00 01  00 04 01 00                                                                                GET MAX                                 70.1.0        
  15.0  IN     01                                                                                                      .                                       70.2.0        
  15.0  CTL    a1 87 00 01  00 04 01 00                                                                                GET DEF                                 71.1.0        
  15.0  IN     00                                                                                                      .                                       71.2.0        
  15.0  CTL    a1 85 00 04  00 04 02 00                                                                                GET LEN                                 72.1.0        
  15.0  IN     01 00                                                                                                   ..                                      72.2.0        
  15.0  CTL    a1 86 00 04  00 04 01 00                                                                                GET INFO                                73.1.0        
  15.0  IN     03                                                                                                      .                                       73.2.0        
  15.0  CTL    a1 85 00 04  00 04 02 00                                                                                GET LEN                                 74.1.0        
  15.0  IN     01 00                                                                                                   ..                                      74.2.0        
  15.0  CTL    a1 84 00 04  00 04 01 00                                                                                GET RES                                 75.1.0        
  15.0  IN     01                                                                                                      .                                       75.2.0        
  15.0  CTL    a1 82 00 04  00 04 01 00                                                                                GET MIN                                 76.1.0        
  15.0  IN     00                                                                                                      .                                       76.2.0        
  15.0  CTL    a1 83 00 04  00 04 01 00                                                                                GET MAX                                 77.1.0        
  15.0  IN     01                                                                                                      .                                       77.2.0        
  15.0  CTL    a1 87 00 04  00 04 01 00                                                                                GET DEF                                 78.1.0        
  15.0  IN     00                                                                                                      .                                       78.2.0        
  15.0  CTL    a1 85 00 09  00 04 02 00                                                                                GET LEN                                 79.1.0        
  15.0  IN     02 00                                                                                                   ..                                      79.2.0        
  15.0  CTL    a1 86 00 09  00 04 01 00                                                                                GET INFO                                80.1.0        
  15.0  IN     03                                                                                                      .                                       80.2.0        
  15.0  CTL    a1 85 00 09  00 04 02 00                                                                                GET LEN                                 81.1.0        
  15.0  IN     02 00                                                                                                   ..                                      81.2.0        
  15.0  CTL    a1 84 00 09  00 04 02 00                                                                                GET RES                                 82.1.0        
  15.0  IN     01 01                                                                                                   ..                                      82.2.0        
  15.0  CTL    a1 82 00 09  00 04 02 00                                                                                GET MIN                                 83.1.0        
  15.0  IN     00 00                                                                                                   ..                                      83.2.0        
  15.0  CTL    a1 83 00 09  00 04 02 00                                                                                GET MAX                                 84.1.0        
  15.0  IN     01 ff                                                                                                   ..                                      84.2.0        
  15.0  CTL    a1 87 00 09  00 04 02 00                                                                                GET DEF                                 85.1.0        
  15.0  IN     01 0a                                                                                                   ..                                      85.2.0        
  15.0  CTL    a1 85 00 01  00 06 02 00                                                                                GET LEN                                 86.1.0        
  15.0  IN     02 00                                                                                                   ..                                      86.2.0        
  15.0  CTL    a1 86 00 01  00 06 01 00                                                                                GET INFO                                87.1.0        
  15.0  IN     03                                                                                                      .                                       87.2.0        
  15.0  CTL    a1 85 00 01  00 06 02 00                                                                                GET LEN                                 88.1.0        
  15.0  IN     02 00                                                                                                   ..                                      88.2.0        
  15.0  CTL    a1 84 00 01  00 06 02 00                                                                                GET RES                                 89.1.0        
  15.0  IN     01 00                                                                                                   ..                                      89.2.0        
  15.0  CTL    a1 82 00 01  00 06 02 00                                                                                GET MIN                                 90.1.0        
  15.0  IN     00 20                                                                                                   .                                       90.2.0        
  15.0  CTL    a1 83 00 01  00 06 02 00                                                                                GET MAX                                 91.1.0        
  15.0  IN     ff 2c                                                                                                   .,                                      91.2.0        
  15.0  CTL    a1 87 00 01  00 06 02 00                                                                                GET DEF                                 92.1.0        
  15.0  IN     10 20                                                                                                   .                                       92.2.0        
  15.0  CTL    a1 85 00 02  00 06 02 00                                                                                GET LEN                                 93.1.0        
  15.0  IN     01 00                                                                                                   ..                                      93.2.0        
  15.0  CTL    a1 86 00 02  00 06 01 00                                                                                GET INFO                                94.1.0        
  15.0  IN     03                                                                                                      .                                       94.2.0        
  15.0  CTL    a1 85 00 02  00 06 02 00                                                                                GET LEN                                 95.1.0        
  15.0  IN     01 00                                                                                                   ..                                      95.2.0        
  15.0  CTL    a1 84 00 02  00 06 01 00                                                                                GET RES                                 96.1.0        
  15.0  IN     01                                                                                                      .                                       96.2.0        
  15.0  CTL    a1 82 00 02  00 06 01 00                                                                                GET MIN                                 97.1.0        
  15.0  IN     00                                                                                                      .                                       97.2.0        
  15.0  CTL    a1 83 00 02  00 06 01 00                                                                                GET MAX                                 98.1.0        
  15.0  IN     ff                                                                                                      .                                       98.2.0        
  15.0  CTL    a1 87 00 02  00 06 01 00                                                                                GET DEF                                 99.1.0        
  15.0  IN     dd                                                                                                      .                                       99.2.0        
  15.0  CTL    a1 85 00 03  00 06 02 00                                                                                GET LEN                                100.1.0        
  15.0  IN     02 00                                                                                                   ..                                     100.2.0        
  15.0  CTL    a1 86 00 03  00 06 01 00                                                                                GET INFO                               101.1.0        
  15.0  IN     03                                                                                                      .                                      101.2.0        
  15.0  CTL    a1 85 00 03  00 06 02 00                                                                                GET LEN                                102.1.0        
  15.0  IN     02 00                                                                                                   ..                                     102.2.0        
  15.0  CTL    a1 84 00 03  00 06 02 00                                                                                GET RES                                103.1.0        
  15.0  IN     01 00                                                                                                   ..                                     103.2.0        
  15.0  CTL    a1 82 00 03  00 06 02 00                                                                                GET MIN                                104.1.0        
  15.0  IN     00 00                                                                                                   ..                                     104.2.0        
  15.0  CTL    a1 83 00 03  00 06 02 00                                                                                GET MAX                                105.1.0        
  15.0  IN     ff ff                                                                                                   ..                                     105.2.0        
  15.0  CTL    a1 87 00 03  00 06 02 00                                                                                GET DEF                                106.1.0        
  15.0  IN     00 00                                                                                                   ..                                     106.2.0        
  15.0  CTL    a1 85 00 04  00 06 02 00                                                                                GET LEN                                107.1.0        
  15.0  IN     01 00                                                                                                   ..                                     107.2.0        
  15.0  CTL    a1 86 00 04  00 06 01 00                                                                                GET INFO                               108.1.0        
  15.0  IN     03                                                                                                      .                                      108.2.0        
  15.0  CTL    a1 85 00 04  00 06 02 00                                                                                GET LEN                                109.1.0        
  15.0  IN     01 00                                                                                                   ..                                     109.2.0        
  15.0  CTL    a1 84 00 04  00 06 01 00                                                                                GET RES                                110.1.0        
  15.0  IN     01                                                                                                      .                                      110.2.0        
  15.0  CTL    a1 82 00 04  00 06 01 00                                                                                GET MIN                                111.1.0        
  15.0  IN     00                                                                                                      .                                      111.2.0        
  15.0  CTL    a1 83 00 04  00 06 01 00                                                                                GET MAX                                112.1.0        
  15.0  IN     ff                                                                                                      .                                      112.2.0        
  15.0  CTL    a1 87 00 04  00 06 01 00                                                                                GET DEF                                113.1.0        
  15.0  IN     1a                                                                                                      .                                      113.2.0        
  15.0  CTL    a1 85 00 05  00 06 02 00                                                                                GET LEN                                114.1.0        
  15.0  IN     02 00                                                                                                   ..                                     114.2.0        
  15.0  CTL    a1 86 00 05  00 06 01 00                                                                                GET INFO                               115.1.0        
  15.0  IN     03                                                                                                      .                                      115.2.0        
  15.0  CTL    a1 85 00 05  00 06 02 00                                                                                GET LEN                                116.1.0        
  15.0  IN     02 00                                                                                                   ..                                     116.2.0        
  15.0  CTL    a1 84 00 05  00 06 02 00                                                                                GET RES                                117.1.0        
  15.0  IN     01 00                                                                                                   ..                                     117.2.0        
  15.0  CTL    a1 82 00 05  00 06 02 00                                                                                GET MIN                                118.1.0        
  15.0  IN     00 00                                                                                                   ..                                     118.2.0        
  15.0  CTL    a1 83 00 05  00 06 02 00                                                                                GET MAX                                119.1.0        
  15.0  IN     ff ff                                                                                                   ..                                     119.2.0        
  15.0  CTL    a1 87 00 05  00 06 02 00                                                                                GET DEF                                120.1.0        
  15.0  IN     10 96                                                                                                   ..                                     120.2.0        
  15.0  CTL    a1 85 00 06  00 06 02 00                                                                                GET LEN                                121.1.0        
  15.0  IN     02 00                                                                                                   ..                                     121.2.0        
  15.0  CTL    a1 86 00 06  00 06 01 00                                                                                GET INFO                               122.1.0        
  15.0  IN     03                                                                                                      .                                      122.2.0        
  15.0  CTL    a1 85 00 06  00 06 02 00                                                                                GET LEN                                123.1.0        
  15.0  IN     02 00                                                                                                   ..                                     123.2.0        
  15.0  CTL    a1 84 00 06  00 06 02 00                                                                                GET RES                                124.1.0        
  15.0  IN     01 00                                                                                                   ..                                     124.2.0        
  15.0  CTL    a1 82 00 06  00 06 02 00                                                                                GET MIN                                125.1.0        
  15.0  IN     00 00                                                                                                   ..                                     125.2.0        
  15.0  CTL    a1 83 00 06  00 06 02 00                                                                                GET MAX                                126.1.0        
  15.0  IN     ff ff                                                                                                   ..                                     126.2.0        
  15.0  CTL    a1 87 00 06  00 06 02 00                                                                                GET DEF                                127.1.0        
  15.0  IN     cf a8                                                                                                   ..                                     127.2.0        
  15.0  CTL    a1 85 00 07  00 06 02 00                                                                                GET LEN                                128.1.0        
  15.0  IN     05 00                                                                                                   ..                                     128.2.0        
  15.0  CTL    a1 86 00 07  00 06 01 00                                                                                GET INFO                               129.1.0        
  15.0  IN     03                                                                                                      .                                      129.2.0        
  15.0  CTL    a1 85 00 07  00 06 02 00                                                                                GET LEN                                130.1.0        
  15.0  IN     05 00                                                                                                   ..                                     130.2.0        
  15.0  CTL    a1 84 00 07  00 06 05 00                                                                                GET RES                                131.1.0        
  15.0  IN     01 01 01 01  00                                                                                         .....                                  131.2.0        
  15.0  CTL    a1 82 00 07  00 06 05 00                                                                                GET MIN                                132.1.0        
  15.0  IN     00 00 00 00  00                                                                                         .....                                  132.2.0        
  15.0  CTL    a1 83 00 07  00 06 05 00                                                                                GET MAX                                133.1.0        
  15.0  IN     ff ff ff ff  ff                                                                                         .....                                  133.2.0        
  15.0  CTL    a1 87 00 07  00 06 05 00                                                                                GET DEF                                134.1.0        
  15.0  IN     cc 40 18 9f  24                                                                                         .@..$                                  134.2.0        
  15.0  CTL    a1 85 00 08  00 06 02 00                                                                                GET LEN                                135.1.0        
  15.0  IN     06 00                                                                                                   ..                                     135.2.0        
  15.0  CTL    a1 86 00 08  00 06 01 00                                                                                GET INFO                               136.1.0        
  15.0  IN     03                                                                                                      .                                      136.2.0        
  15.0  CTL    a1 85 00 08  00 06 02 00                                                                                GET LEN                                137.1.0        
  15.0  IN     06 00                                                                                                   ..                                     137.2.0        
  15.0  CTL    a1 84 00 08  00 06 06 00                                                                                GET RES                                138.1.0        
  15.0  IN     01 01 01 00  01 00                                                                                      ......                                 138.2.0        
  15.0  CTL    a1 82 00 08  00 06 06 00                                                                                GET MIN                                139.1.0        
  15.0  IN     00 00 00 00  00 00                                                                                      ......                                 139.2.0        
  15.0  CTL    a1 83 00 08  00 06 06 00                                                                                GET MAX                                140.1.0        
  15.0  IN     ff ff ff ff  ff ff                                                                                      ......                                 140.2.0        
  15.0  CTL    a1 87 00 08  00 06 06 00                                                                                GET DEF                                141.1.0        
  15.0  IN     04 00 00 00  02 00                                                                                      ......                                 141.2.0        
  15.0  CTL    a1 85 00 09  00 06 02 00                                                                                GET LEN                                142.1.0        
  15.0  IN     02 00                                                                                                   ..                                     142.2.0        
  15.0  CTL    a1 86 00 09  00 06 01 00                                                                                GET INFO                               143.1.0        
  15.0  IN     03                                                                                                      .                                      143.2.0        
  15.0  CTL    a1 85 00 09  00 06 02 00                                                                                GET LEN                                144.1.0        
  15.0  IN     02 00                                                                                                   ..                                     144.2.0        
  15.0  CTL    a1 84 00 09  00 06 02 00                                                                                GET RES                                145.1.0        
  15.0  IN     02 00                                                                                                   ..                                     145.2.0        
  15.0  CTL    a1 82 00 09  00 06 02 00                                                                                GET MIN                                146.1.0        
  15.0  IN     02 00                                                                                                   ..                                     146.2.0        
  15.0  CTL    a1 83 00 09  00 06 02 00                                                                                GET MAX                                147.1.0        
  15.0  IN     02 00                                                                                                   ..                                     147.2.0        
  15.0  CTL    a1 87 00 09  00 06 02 00                                                                                GET DEF                                148.1.0        
  15.0  IN     02 00                                                                                                   ..                                     148.2.0        
  15.0  CTL    a1 85 00 0a  00 06 02 00                                                                                GET LEN                                149.1.0        
  15.0  IN     01 00                                                                                                   ..                                     149.2.0        
  15.0  CTL    a1 86 00 0a  00 06 01 00                                                                                GET INFO                               150.1.0        
  15.0  IN     03                                                                                                      .                                      150.2.0        
  15.0  CTL    a1 85 00 0a  00 06 02 00                                                                                GET LEN                                151.1.0        
  15.0  IN     01 00                                                                                                   ..                                     151.2.0        
  15.0  CTL    a1 84 00 0a  00 06 01 00                                                                                GET RES                                152.1.0        
  15.0  IN     01                                                                                                      .                                      152.2.0        
  15.0  CTL    a1 82 00 0a  00 06 01 00                                                                                GET MIN                                153.1.0        
  15.0  IN     00                                                                                                      .                                      153.2.0        
  15.0  CTL    a1 83 00 0a  00 06 01 00                                                                                GET MAX                                154.1.0        
  15.0  IN     ff                                                                                                      .                                      154.2.0        
  15.0  CTL    a1 87 00 0a  00 06 01 00                                                                                GET DEF                                155.1.0        
  15.0  IN     00                                                                                                      .                                      155.2.0        
  15.0  CTL    a1 85 00 0b  00 06 02 00                                                                                GET LEN                                156.1.0        
  15.0  IN     01 00                                                                                                   ..                                     156.2.0        
  15.0  CTL    a1 86 00 0b  00 06 01 00                                                                                GET INFO                               157.1.0        
  15.0  IN     03                                                                                                      .                                      157.2.0        
  15.0  CTL    a1 85 00 0b  00 06 02 00                                                                                GET LEN                                158.1.0        
  15.0  IN     01 00                                                                                                   ..                                     158.2.0        
  15.0  CTL    a1 84 00 0b  00 06 01 00                                                                                GET RES                                159.1.0        
  15.0  IN     01                                                                                                      .                                      159.2.0        
  15.0  CTL    a1 82 00 0b  00 06 01 00                                                                                GET MIN                                160.1.0        
  15.0  IN     00                                                                                                      .                                      160.2.0        
  15.0  CTL    a1 83 00 0b  00 06 01 00                                                                                GET MAX                                161.1.0        
  15.0  IN     03                                                                                                      .                                      161.2.0        
  15.0  CTL    a1 87 00 0b  00 06 01 00                                                                                GET DEF                                162.1.0        
  15.0  IN     00                                                                                                      .                                      162.2.0        
  15.0  CTL    a1 85 00 0c  00 06 02 00                                                                                GET LEN                                163.1.0        
  15.0  IN     01 00                                                                                                   ..                                     163.2.0        
  15.0  CTL    a1 86 00 0c  00 06 01 00                                                                                GET INFO                               164.1.0        
  15.0  IN     03                                                                                                      .                                      164.2.0        
  15.0  CTL    a1 85 00 0c  00 06 02 00                                                                                GET LEN                                165.1.0        
  15.0  IN     01 00                                                                                                   ..                                     165.2.0        
  15.0  CTL    a1 84 00 0c  00 06 01 00                                                                                GET RES                                166.1.0        
  15.0  IN     01                                                                                                      .                                      166.2.0        
  15.0  CTL    a1 82 00 0c  00 06 01 00                                                                                GET MIN                                167.1.0        
  15.0  IN     00                                                                                                      .                                      167.2.0        
  15.0  CTL    a1 83 00 0c  00 06 01 00                                                                                GET MAX                                168.1.0        
  15.0  IN     01                                                                                                      .                                      168.2.0        
  15.0  CTL    a1 87 00 0c  00 06 01 00                                                                                GET DEF                                169.1.0        
  15.0  IN     01                                                                                                      .                                      169.2.0        
  15.0  CTL    a1 85 00 0d  00 06 02 00                                                                                GET LEN                                170.1.0        
  15.0  IN     01 00                                                                                                   ..                                     170.2.0        
  15.0  CTL    a1 86 00 0d  00 06 01 00                                                                                GET INFO                               171.1.0        
  15.0  IN     03                                                                                                      .                                      171.2.0        
  15.0  CTL    a1 85 00 0d  00 06 02 00                                                                                GET LEN                                172.1.0        
  15.0  IN     01 00                                                                                                   ..                                     172.2.0        
  15.0  CTL    a1 84 00 0d  00 06 01 00                                                                                GET RES                                173.1.0        
  15.0  IN     01                                                                                                      .                                      173.2.0        
  15.0  CTL    a1 82 00 0d  00 06 01 00                                                                                GET MIN                                174.1.0        
  15.0  IN     00                                                                                                      .                                      174.2.0        
  15.0  CTL    a1 83 00 0d  00 06 01 00                                                                                GET MAX                                175.1.0        
  15.0  IN     01                                                                                                      .                                      175.2.0        
  15.0  CTL    a1 87 00 0d  00 06 01 00                                                                                GET DEF                                176.1.0        
  15.0  IN     00                                                                                                      .                                      176.2.0        
  15.0  CTL    a1 85 00 0e  00 06 02 00                                                                                GET LEN                                177.1.0        
  15.0  IN     01 00                                                                                                   ..                                     177.2.0        
  15.0  CTL    a1 86 00 0e  00 06 01 00                                                                                GET INFO                               178.1.0        
  15.0  IN     03                                                                                                      .                                      178.2.0        
  15.0  CTL    a1 85 00 0e  00 06 02 00                                                                                GET LEN                                179.1.0        
  15.0  IN     01 00                                                                                                   ..                                     179.2.0        
  15.0  CTL    a1 84 00 0e  00 06 01 00                                                                                GET RES                                180.1.0        
  15.0  IN     01                                                                                                      .                                      180.2.0        
  15.0  CTL    a1 82 00 0e  00 06 01 00                                                                                GET MIN                                181.1.0        
  15.0  IN     00                                                                                                      .                                      181.2.0        
  15.0  CTL    a1 83 00 0e  00 06 01 00                                                                                GET MAX                                182.1.0        
  15.0  IN     03                                                                                                      .                                      182.2.0        
  15.0  CTL    a1 87 00 0e  00 06 01 00                                                                                GET DEF                                183.1.0        
  15.0  IN     01                                                                                                      .                                      183.2.0        
  15.0  CTL    a1 85 00 0f  00 06 02 00                                                                                GET LEN                                184.1.0        
  15.0  IN     01 00                                                                                                   ..                                     184.2.0        
  15.0  CTL    a1 86 00 0f  00 06 01 00                                                                                GET INFO                               185.1.0        
  15.0  IN     03                                                                                                      .                                      185.2.0        
  15.0  CTL    a1 85 00 0f  00 06 02 00                                                                                GET LEN                                186.1.0        
  15.0  IN     01 00                                                                                                   ..                                     186.2.0        
  15.0  CTL    a1 84 00 0f  00 06 01 00                                                                                GET RES                                187.1.0        
  15.0  IN     01                                                                                                      .                                      187.2.0        
  15.0  CTL    a1 82 00 0f  00 06 01 00                                                                                GET MIN                                188.1.0        
  15.0  IN     00                                                                                                      .                                      188.2.0        
  15.0  CTL    a1 83 00 0f  00 06 01 00                                                                                GET MAX                                189.1.0        
  15.0  IN     3f                                                                                                      ?                                      189.2.0        
  15.0  CTL    a1 87 00 0f  00 06 01 00                                                                                GET DEF                                190.1.0        
  15.0  IN     01                                                                                                      .                                      190.2.0        
  15.0  CTL    a1 85 00 10  00 06 02 00                                                                                GET LEN                                191.1.0        
  15.0  IN     01 00                                                                                                   ..                                     191.2.0        
  15.0  CTL    a1 86 00 10  00 06 01 00                                                                                GET INFO                               192.1.0        
  15.0  IN     03                                                                                                      .                                      192.2.0        
  15.0  CTL    a1 85 00 10  00 06 02 00                                                                                GET LEN                                193.1.0        
  15.0  IN     01 00                                                                                                   ..                                     193.2.0        
  15.0  CTL    a1 84 00 10  00 06 01 00                                                                                GET RES                                194.1.0        
  15.0  IN     01                                                                                                      .                                      194.2.0        
  15.0  CTL    a1 82 00 10  00 06 01 00                                                                                GET MIN                                195.1.0        
  15.0  IN     00                                                                                                      .                                      195.2.0        
  15.0  CTL    a1 83 00 10  00 06 01 00                                                                                GET MAX                                196.1.0        
  15.0  IN     02                                                                                                      .                                      196.2.0        
  15.0  CTL    a1 87 00 10  00 06 01 00                                                                                GET DEF                                197.1.0        
  15.0  IN     01                                                                                                      .                                      197.2.0        
  15.0  CTL    a1 85 00 11  00 06 02 00                                                                                GET LEN                                198.1.0        
  15.0  IN     04 00                                                                                                   ..                                     198.2.0        
  15.0  CTL    a1 86 00 11  00 06 01 00                                                                                GET INFO                               199.1.0        
  15.0  IN     03                                                                                                      .                                      199.2.0        
  15.0  CTL    a1 85 00 11  00 06 02 00                                                                                GET LEN                                200.1.0        
  15.0  IN     04 00                                                                                                   ..                                     200.2.0        
  15.0  CTL    a1 84 00 11  00 06 04 00                                                                                GET RES                                201.1.0        
  15.0  IN     01 00 00 00                                                                                             ....                                   201.2.0        
  15.0  CTL    a1 82 00 11  00 06 04 00                                                                                GET MIN                                202.1.0        
  15.0  IN     0a 00 00 00                                                                                             ....                                   202.2.0        
  15.0  CTL    a1 83 00 11  00 06 04 00                                                                                GET MAX                                203.1.0        
  15.0  IN     e8 03 00 00                                                                                             ....                                   203.2.0        
  15.0  CTL    a1 87 00 11  00 06 04 00                                                                                GET DEF                                204.1.0        
  15.0  IN     a6 00 00 00                                                                                             ....                                   204.2.0        
  15.0  CTL    a1 85 00 12  00 06 02 00                                                                                GET LEN                                205.1.0        
  15.0  IN     01 00                                                                                                   ..                                     205.2.0        
  15.0  CTL    a1 86 00 12  00 06 01 00                                                                                GET INFO                               206.1.0        
  15.0  IN     01                                                                                                      .                                      206.2.0        
  15.0  CTL    a1 85 00 12  00 06 02 00                                                                                GET LEN                                207.1.0        
  15.0  IN     01 00                                                                                                   ..                                     207.2.0        
  15.0  CTL    a1 84 00 12  00 06 01 00                                                                                GET RES                                208.1.0        
  15.0  IN     01                                                                                                      .                                      208.2.0        
  15.0  CTL    a1 82 00 12  00 06 01 00                                                                                GET MIN                                209.1.0        
  15.0  IN     01                                                                                                      .                                      209.2.0        
  15.0  CTL    a1 83 00 12  00 06 01 00                                                                                GET MAX                                210.1.0        
  15.0  IN     01                                                                                                      .                                      210.2.0        
  15.0  CTL    a1 87 00 12  00 06 01 00                                                                                GET DEF                                211.1.0        
  15.0  IN     01                                                                                                      .                                      211.2.0        
  15.0  CTL    a1 85 00 09  00 07 02 00                                                                                GET LEN                                212.1.0        
  15.0  IN     05 00                                                                                                   ..                                     212.2.0        
  15.0  CTL    a1 86 00 09  00 07 01 00                                                                                GET INFO                               213.1.0        
  15.0  IN     03                                                                                                      .                                      213.2.0        
  15.0  CTL    a1 85 00 09  00 07 02 00                                                                                GET LEN                                214.1.0        
  15.0  IN     05 00                                                                                                   ..                                     214.2.0        
  15.0  CTL    a1 84 00 09  00 07 05 00                                                                                GET RES                                215.1.0        
  15.0  IN     01 01 01 01  01                                                                                         .....                                  215.2.0        
  15.0  CTL    a1 82 00 09  00 07 05 00                                                                                GET MIN                                216.1.0        
  15.0  IN     01 00 00 00  01                                                                                         .....                                  216.2.0        
  15.0  CTL    a1 83 00 09  00 07 05 00                                                                                GET MAX                                217.1.0        
  15.0  IN     02 03 03 83  0a                                                                                         .....                                  217.2.0        
  15.0  CTL    a1 87 00 09  00 07 05 00                                                                                GET DEF                                218.1.0        
  15.0  IN     01 03 01 00  0a                                                                                         .....                                  218.2.0        
  15.0  CTL    a1 85 00 0a  00 07 02 00                                                                                GET LEN                                219.1.0        
  15.0  IN     02 00                                                                                                   ..                                     219.2.0        
  15.0  CTL    a1 86 00 0a  00 07 01 00                                                                                GET INFO                               220.1.0        
  15.0  IN     01                                                                                                      .                                      220.2.0        
  15.0  CTL    a1 85 00 0a  00 07 02 00                                                                                GET LEN                                221.1.0        
  15.0  IN     02 00                                                                                                   ..                                     221.2.0        
  15.0  CTL    a1 84 00 0a  00 07 02 00                                                                                GET RES                                222.1.0        
  15.0  IN     01 00                                                                                                   ..                                     222.2.0        
  15.0  CTL    a1 82 00 0a  00 07 02 00                                                                                GET MIN                                223.1.0        
  15.0  IN     00 00                                                                                                   ..                                     223.2.0        
  15.0  CTL    a1 83 00 0a  00 07 02 00                                                                                GET MAX                                224.1.0        
  15.0  IN     ff ff                                                                                                   ..                                     224.2.0        
  15.0  CTL    a1 87 00 0a  00 07 02 00                                                                                GET DEF                                225.1.0        
  15.0  IN     00 00                                                                                                   ..                                     225.2.0        
  15.0  CTL    a1 81 00 01  00 03 04 00                                                                                GET CUR                                226.1.0        
  15.0  IN     01 07 f3 03                                                                                             ....                                   226.2.0        
  15.0  CTL    a1 81 00 05  00 03 02 00                                                                                GET CUR                                227.1.0        
  15.0  IN     01 72                                                                                                   .r                                     227.2.0        
  15.0  CTL    a1 81 00 04  00 03 02 00                                                                                GET CUR                                228.1.0        
  15.0  IN     02 00                                                                                                   ..                                     228.2.0        
  15.0  CTL    a1 81 00 01  00 03 04 00                                                                                GET CUR                                229.1.0        
  15.0  IN     01 07 f3 03                                                                                             ....                                   229.2.0        
  15.0  CTL    a1 81 00 02  00 03 02 00                                                                                GET CUR                                230.1.0        
  15.0  IN     e0 f3                                                                                                   ..                                     230.2.0        
  15.0  CTL    a1 81 00 03  00 03 02 00                                                                                GET CUR                                231.1.0        
  15.0  IN     1b 01                                                                                                   ..                                     231.2.0        
  15.0  CTL    a1 81 00 04  00 03 02 00                                                                                GET CUR                                232.1.0        
  15.0  IN     02 00                                                                                                   ..                                     232.2.0        
  15.0  CTL    a1 81 00 05  00 03 02 00                                                                                GET CUR                                233.1.0        
  15.0  IN     01 72                                                                                                   .r                                     233.2.0        
  15.0  CTL    a1 81 00 06  00 03 06 00                                                                                GET CUR                                234.1.0        
  15.0  IN     6d 04 25 08  12 00                                                                                      m.%...                                 234.2.0        
  15.0  CTL    a1 81 00 04  00 03 02 00                                                                                GET CUR                                235.1.0(2)     
  15.0  IN     02 00                                                                                                   ..                                     235.2.0        
  15.0  CTL    a1 86 00 02  00 02 01 00                                                                                GET INFO                               237.1.0        
  15.0  IN     03                                                                                                      .                                      237.2.0        
  15.0  CTL    a1 82 00 02  00 02 02 00                                                                                GET MIN                                238.1.0        
  15.0  IN     00 00                                                                                                   ..                                     238.2.0        
  15.0  CTL    a1 83 00 02  00 02 02 00                                                                                GET MAX                                239.1.0        
  15.0  IN     ff 00                                                                                                   ..                                     239.2.0        
  15.0  CTL    a1 87 00 02  00 02 02 00                                                                                GET DEF                                240.1.0        
  15.0  IN     80 00                                                                                                   ..                                     240.2.0        
  15.0  CTL    a1 86 00 03  00 02 01 00                                                                                GET INFO                               241.1.0        
  15.0  IN     03                                                                                                      .                                      241.2.0        
  15.0  CTL    a1 82 00 03  00 02 02 00                                                                                GET MIN                                242.1.0        
  15.0  IN     00 00                                                                                                   ..                                     242.2.0        
  15.0  CTL    a1 83 00 03  00 02 02 00                                                                                GET MAX                                243.1.0        
  15.0  IN     ff 00                                                                                                   ..                                     243.2.0        
  15.0  CTL    a1 87 00 03  00 02 02 00                                                                                GET DEF                                244.1.0        
  15.0  IN     20 00                                                                                                    .                                     244.2.0        
  15.0  CTL    a1 86 00 07  00 02 01 00                                                                                GET INFO                               245.1.0        
  15.0  IN     03                                                                                                      .                                      245.2.0        
  15.0  CTL    a1 82 00 07  00 02 02 00                                                                                GET MIN                                246.1.0        
  15.0  IN     00 00                                                                                                   ..                                     246.2.0        
  15.0  CTL    a1 83 00 07  00 02 02 00                                                                                GET MAX                                247.1.0        
  15.0  IN     ff 00                                                                                                   ..                                     247.2.0        
  15.0  CTL    a1 87 00 07  00 02 02 00                                                                                GET DEF                                248.1.0        
  15.0  IN     20 00                                                                                                    .                                     248.2.0        
  15.0  CTL    a1 86 00 08  00 02 01 00                                                                                GET INFO                               249.1.0        
  15.0  IN     03                                                                                                      .                                      249.2.0        
  15.0  CTL    a1 82 00 08  00 02 02 00                                                                                GET MIN                                250.1.0        
  15.0  IN     00 00                                                                                                   ..                                     250.2.0        
  15.0  CTL    a1 83 00 08  00 02 02 00                                                                                GET MAX                                251.1.0        
  15.0  IN     ff 00                                                                                                   ..                                     251.2.0        
  15.0  CTL    a1 87 00 08  00 02 02 00                                                                                GET DEF                                252.1.0        
  15.0  IN     18 00                                                                                                   ..                                     252.2.0        
  15.0  CTL    a1 86 00 0a  00 02 01 00                                                                                GET INFO                               253.1.0        
  15.0  IN     0f                                                                                                      .                                      253.2.0        
  15.0  CTL    a1 82 00 0a  00 02 02 00                                                                                GET MIN                                254.1.0        
  15.0  IN     00 00                                                                                                   ..                                     254.2.0        
  15.0  CTL    a1 83 00 0a  00 02 02 00                                                                                GET MAX                                255.1.0        
  15.0  IN     10 27                                                                                                   .'                                     255.2.0        
  15.0  CTL    a1 84 00 0a  00 02 02 00                                                                                GET RES                                256.1.0        
  15.0  IN     0a 00                                                                                                   ..                                     256.2.0        
  15.0  CTL    a1 87 00 0a  00 02 02 00                                                                                GET DEF                                257.1.0        
  15.0  IN     a0 0f                                                                                                   ..                                     257.2.0        
  15.0  CTL    a1 86 00 01  00 02 01 00                                                                                GET INFO                               258.1.0        
  15.0  IN     03                                                                                                      .                                      258.2.0        
  15.0  CTL    a1 82 00 01  00 02 02 00                                                                                GET MIN                                259.1.0        
  15.0  IN     00 00                                                                                                   ..                                     259.2.0        
  15.0  CTL    a1 83 00 01  00 02 02 00                                                                                GET MAX                                260.1.0        
  15.0  IN     01 00                                                                                                   ..                                     260.2.0        
  15.0  CTL    a1 84 00 01  00 02 02 00                                                                                GET RES                                261.1.0        
  15.0  IN     01 00                                                                                                   ..                                     261.2.0        
  15.0  CTL    a1 87 00 01  00 02 02 00                                                                                GET DEF                                262.1.0        
  15.0  IN     00 00                                                                                                   ..                                     262.2.0        
  15.0  CTL    a1 86 00 04  00 02 01 00                                                                                GET INFO                               263.1.0        
  15.0  IN     0b                                                                                                      .                                      263.2.0        
  15.0  CTL    a1 82 00 04  00 02 02 00                                                                                GET MIN                                264.1.0        
  15.0  IN     00 00                                                                                                   ..                                     264.2.0        
  15.0  CTL    a1 83 00 04  00 02 02 00                                                                                GET MAX                                265.1.0        
  15.0  IN     ff 00                                                                                                   ..                                     265.2.0        
  15.0  CTL    a1 87 00 04  00 02 02 00                                                                                GET DEF                                266.1.0        
  15.0  IN     40 00                                                                                                   @.                                     266.2.0        
  15.0  CTL    a1 86 00 05  00 02 01 00                                                                                GET INFO                               267.1.0        
  15.0  IN     03                                                                                                      .                                      267.2.0        
  15.0  CTL    a1 87 00 05  00 02 01 00                                                                                GET DEF                                268.1.0        
  15.0  IN     02                                                                                                      .                                      268.2.0        
  15.0  CTL    a1 86 00 0b  00 02 01 00                                                                                GET INFO                               269.1.0        
  15.0  IN     0f                                                                                                      .                                      269.2.0        
  15.0  CTL    a1 87 00 0b  00 02 01 00                                                                                GET DEF                                270.1.0        
  15.0  IN     01                                                                                                      .                                      270.2.0        
  15.0  CTL    a1 81 00 0a  00 03 04 00                                                                                GET CUR                                271.1.0        
  15.0  IN     00 05 d0 02                                                                                             ....                                   271.2.0        
  15.0  CTL    a1 86 00 04  00 01 01 00                                                                                GET INFO                               272.1.0        
  15.0  IN     0f                                                                                                      .                                      272.2.0        
  15.0  CTL    a1 82 00 04  00 01 04 00                                                                                GET MIN                                273.1.0        
  15.0  IN     01 00 00 00                                                                                             ....                                   273.2.0        
  15.0  CTL    a1 83 00 04  00 01 04 00                                                                                GET MAX                                274.1.0        
  15.0  IN     10 27 00 00                                                                                             .'..                                   274.2.0        
  15.0  CTL    a1 84 00 04  00 01 04 00                                                                                GET RES                                275.1.0        
  15.0  IN     01 00 00 00                                                                                             ....                                   275.2.0        
  15.0  CTL    a1 87 00 04  00 01 04 00                                                                                GET DEF                                276.1.0        
  15.0  IN     a6 00 00 00                                                                                             ....                                   276.2.0        
  15.0  CTL    a1 86 00 03  00 01 01 00                                                                                GET INFO                               277.1.0        
  15.0  IN     03                                                                                                      .                                      277.2.0        
  15.0  CTL    a1 87 00 03  00 01 01 00                                                                                GET DEF                                278.1.0        
  15.0  IN     01                                                                                                      .                                      278.2.0        
  15.0  CTL    a1 86 00 0d  00 01 01 00                                                                                GET INFO                               279.1.0(5)     
  15.0  USTS   c0000004                                                                                                stall pid                              279.2.0        
  15.0  CTL    a1 81 00 02  00 00 01 00                                                                                GET CUR                                280.1.0(5)     
  15.0  IN     06                                                                                                      .                                      280.2.0        
  15.0  CTL    a1 86 00 02  00 01 01 00                                                                                GET INFO                               289.1.0        
  15.0  IN     0f                                                                                                      .                                      289.2.0        
  15.0  CTL    a1 87 00 02  00 01 01 00                                                                                GET DEF                                290.1.0        
  15.0  IN     08                                                                                                      .                                      290.2.0        
  15.0  CTL    a1 82 00 04  00 01 04 00                                                                                GET MIN                                291.1.0        
  15.0  IN     01 00 00 00                                                                                             ....                                   291.2.0        
  15.0  CTL    a1 83 00 04  00 01 04 00                                                                                GET MAX                                292.1.0        
  15.0  IN     10 27 00 00                                                                                             .'..                                   292.2.0        
  15.0  CTL    a1 84 00 04  00 01 04 00                                                                                GET RES                                293.1.0        
  15.0  IN     01 00 00 00                                                                                             ....                                   293.2.0        
  15.0  CTL    a1 81 00 01  00 04 01 00                                                                                GET CUR                                294.1.0        
  15.0  IN     00                                                                                                      .                                      294.2.0        
  15.0  CTL    a1 87 00 01  00 04 01 00                                                                                GET DEF                                295.1.0        
  15.0  IN     00                                                                                                      .                                      295.2.0        
  15.0  CTL    a1 82 00 04  00 01 04 00                                                                                GET MIN                                296.1.0        
  15.0  IN     01 00 00 00                                                                                             ....                                   296.2.0        
  15.0  CTL    a1 83 00 04  00 01 04 00                                                                                GET MAX                                297.1.0        
  15.0  IN     10 27 00 00                                                                                             .'..                                   297.2.0        
  15.0  CTL    a1 84 00 04  00 01 04 00                                                                                GET RES                                298.1.0        
  15.0  IN     01 00 00 00                                                                                             ....                                   298.2.0        
  15.0  CTL    a1 87 00 04  00 01 04 00                                                                                GET DEF                                299.1.0        
  15.0  IN     a6 00 00 00                                                                                             ....                                   299.2.0        
  15.0  CTL    a1 81 00 0a  00 07 02 00                                                                                GET CUR                                300.1.0        
  15.0  IN     00 00                                                                                                   ..                                     300.2.0        
  15.0  CTL    a1 81 00 09  00 07 05 00                                                                                GET CUR                                301.1.0        
  15.0  IN     01 03 01 00  0a                                                                                         .....                                  301.2.0        
  15.0  CTL    a1 81 00 10  00 06 01 00                                                                                GET CUR                                302.1.0        
  15.0  IN     01                                                                                                      .                                      302.2.0        
  15.0  CTL    21 01 00 05  00 02 01 00                                                                                SET CUR                                303.1.0        
  15.0  OUT    01                                                                                                      .                                      303.2.0        
  15.0  CTL    21 01 00 04  00 04 01 00                                                                                SET CUR                                304.1.0        
  15.0  OUT    00                                                                                                      .                                      304.2.0        
  15.0  CTL    21 01 00 03  00 01 01 00                                                                                SET CUR                                305.1.0        
  15.0  OUT    00                                                                                                      .                                      305.2.0        
  15.0  CTL    21 01 00 03  00 01 01 00                                                                                SET CUR                                306.1.0        
  15.0  OUT    01                                                                                                      .                                      306.2.0        
  15.0  CTL    21 01 00 04  00 04 01 00                                                                                SET CUR                                307.1.0        
  15.0  OUT    00                                                                                                      .                                      307.2.0        
  15.0  CTL    a1 87 00 03  00 01 01 00                                                                                GET DEF                                308.1.0        
  15.0  IN     01                                                                                                      .                                      308.2.0        
  15.0  CTL    21 01 00 05  00 02 01 00                                                                                SET CUR                                309.1.0        
  15.0  OUT    01                                                                                                      .                                      309.2.0        
  15.0  CTL    21 01 00 09  00 07 05 00                                                                                SET CUR                                310.1.0        
  15.0  OUT    01 03 01 00  0a                                                                                         .....                                  310.2.0        
  16.0  CTL    80 06 00 01  00 00 12 00                                                                                GET DESCRIPTOR                         311.1.0        
  16.0  IN     12 01 00 02  ef 02 01 40  6d 04 25 08  12 00 00 00  02 01                                               .......@m.%.......                     311.2.0        
  16.0  CTL    80 06 00 02  00 00 09 00                                                                                GET DESCRIPTOR                         312.1.0        
  16.0  IN     09 02 ee 00  02 01 00 80  fa                                                                            .........                              312.2.0        
  16.0  CTL    80 06 00 02  00 00 ee 00                                                                                GET DESCRIPTOR                         313.1.0        
  16.0  IN     09 02 ee 00  02 01 00 80  fa 09 04 02  00 00 01 01  00 00 09 24  01 00 01 26  00 01 03 0c  24 02 01 01  ...................$...&....$...       313.2.0        
  16.0  CTL    00 09 01 00  00 00 00 00                                                                                SET CONFIG                             314.1.0        
  16.0  CTL    a1 81 00 01  02 05 01 00                                                                                GET CUR                                315.1.0        
  16.0  IN     00                                                                                                      .                                      315.2.0        
  16.0  CTL    a1 81 00 02  02 05 02 00                                                                                GET CUR                                316.1.0        
  16.0  IN     00 18                                                                                                   ..                                     316.2.0        
  16.0  CTL    a1 82 00 02  02 05 02 00                                                                                GET MIN                                317.1.0        
  16.0  IN     00 06                                                                                                   ..                                     317.2.0        
  16.0  CTL    a1 83 00 02  02 05 02 00                                                                                GET MAX                                318.1.0        
  16.0  IN     00 1e                                                                                                   ..                                     318.2.0        
  16.0  CTL    a1 84 00 02  02 05 02 00                                                                                GET RES                                319.1.0        
  16.0  IN     01 00                                                                                                   ..                                     319.2.0        
  16.0  CTL    01 0b 00 00  03 00 00 00                                                                                SET INTERFACE                          320.1.0        
  11.0  CTL    80 06 00 02  00 00 09 00                                                                                GET DESCRIPTOR                         321.1.0        
  11.0  IN     09 02 a2 09  04 01 00 80  fa                                                                            .........                              321.2.0        
  11.0  CTL    80 06 00 02  00 00 a2 09                                                                                GET DESCRIPTOR                         322.1.0        
  11.0  IN     09 02 a2 09  04 01 00 80  fa 08 0b 00  02 0e 03 00  00 09 04 00  00 01 0e 01  00 00 0d 24  01 00 01 a0  ...........................$....       322.2.0        
